{
  "language": "ru-RU",
  "meta_data": {
    "title": "Новые камеры 2026: Полное руководство по новинкам и ценам",
    "description": "Узнайте о новых камерах 2026 с ценами в России, полные обзоры и сравнения. Найдите свою идеальную камеру.",
    "canonical_url": "https://dawidmillenium-design.github.io/VideoCameraHoliday/ru-RU/guias/nuevas-camaras-2026/"
  },
  "schema_markup": {
    "collection_page": {
      "@context": "https://schema.org",
      "@type": "CollectionPage",
      "name": "Новые камеры 2026: Полное руководство по новинкам и ценам",
      "description": "Узнайте о новых камерах 2026 с ценами в России, полные обзоры и сравнения. Найдите свою идеальную камеру.",
      "url": "https://dawidmillenium-design.github.io/VideoCameraHoliday/ru-RU/guias/nuevas-camaras-2026/",
      "inLanguage": "ru-RU",
      "isPartOf": {
        "@type": "WebSite",
        "name": "VideoCameraHoliday",
        "url": "https://dawidmillenium-design.github.io/VideoCameraHoliday/"
      }
    },
    "faq_page": {
      "@context": "https://schema.org",
      "@type": "FAQPage",
      "mainEntity": [
        {
          "@type": "Question",
          "name": "Какая лучшая новая камера 2026?",
          "acceptedAnswer": {
            "@type": "Answer",
            "text": "Зависит от использования. Для большинства Sony A7 V предлагает лучший баланс фото/видео."
          }
        },
        {
          "@type": "Question",
          "name": "Сколько стоит новая камера в России?",
          "acceptedAnswer": {
            "@type": "Answer",
            "text": "Цены варьируются от 90.000₽ до 200.000₽ в зависимости от модели и магазина."
          }
        },
        {
          "@type": "Question",
          "name": "Где купить импортные камеры?",
          "acceptedAnswer": {
            "@type": "Answer",
            "text": "Рекомендуем официальных продавцов на М.Видео или Эльдорадо для гарантии."
          }
        }
      ]
    },
    "breadcrumb_list": {
      "@context": "https://schema.org",
      "@type": "BreadcrumbList",
      "itemListElement": [
        {
          "@type": "ListItem",
          "position": 1,
          "name": "Главная",
          "item": "https://dawidmillenium-design.github.io/VideoCameraHoliday/главная"
        },
        {
          "@type": "ListItem",
          "position": 2,
          "name": "Новые камеры",
          "item": "https://dawidmillenium-design.github.io/VideoCameraHoliday/главная/новые-камеры"
        },
        {
          "@type": "ListItem",
          "position": 3,
          "name": "Россия",
          "item": "https://dawidmillenium-design.github.io/VideoCameraHoliday/главная/новые-камеры/россия"
        },
        {
          "@type": "ListItem",
          "position": 4,
          "name": "Новые камеры 2026",
          "item": "https://dawidmillenium-design.github.io/VideoCameraHoliday/главная/новые-камеры/россия/новые-камеры-2026"
        }
      ]
    },
    "meta_title": "Новые камеры 2026: Полное руководство по новинкам и ценам",
    "meta_description": "Узнайте о новых камерах 2026 с ценами в России, полные обзоры и сравнения. Найдите свою идеальную камеру."
  },
  "content_brief": {
    "h2_outline": [
      "所有 2026 年新相机",
      "完整对比：规格和价格",
      "每种摄影师的最佳相机",
      "在哪里购买（含最新价格）",
      "我们的测试方法",
      "常见问题"
    ],
    "local_eeat_hooks": [
      "测试地点：Moscow, Saint Petersburg, Sochi",
      "本地零售商价格比较：М.Видео, Эльдорадо, DNS",
      "真实场景测试：城市街道、自然风光、低光环境",
      "气候适应性测试：高温、高湿、寒冷条件",
      "作者资质：10 年以上专业摄影经验"
    ],
    "local_pricing_currency": "₽",
    "local_retailers": [
      "М.Видео",
      "Эльдорадо",
      "DNS",
      "Ozon"
    ],
    "test_locations": [
      "Moscow",
      "Saint Petersburg",
      "Sochi",
      "Lake Baikal"
    ],
    "target_word_count": 4000,
    "tone": "专业但友好，使用本地习语",
    "target_audience": "摄影爱好者和专业视频创作者"
  },
  "internal_link_map": {
    "hub_links": [
      "https://dawidmillenium-design.github.io/VideoCameraHoliday/new-cameras/",
      "https://dawidmillenium-design.github.io/VideoCameraHoliday/ru-RU/guias/"
    ],
    "cluster_links": [
      "https://dawidmillenium-design.github.io/VideoCameraHoliday/ru-RU/guias/fujifilm-x100vi/",
      "https://dawidmillenium-design.github.io/VideoCameraHoliday/ru-RU/guias/sony-a7-v/",
      "https://dawidmillenium-design.github.io/VideoCameraHoliday/ru-RU/guias/dji-pocket-4p/"
    ],
    "regional_links": [
      "https://dawidmillenium-design.github.io/VideoCameraHoliday/ru-RU/guias/best-camera-travel/",
      "https://dawidmillenium-design.github.io/VideoCameraHoliday/ru-RU/guias/professional-cameras/"
    ]
  },
  "keywords": {
    "primary": "новые камеры 2026",
    "long_tail": [
      "лучшие новые камеры 2026 Россия",
      "камеры Sony 2026 цена М.Видео",
      "камеры Canon 2026 Эльдорадо",
      "камеры для путешествий 2026 Москва",
      "профессиональные камеры 2026 Санкт-Петербург"
    ],
    "search_intent": "commercial_investigation"
  },
  "competitor_data": {
    "competitor_gaps": [
      "缺乏本地价格信息（本地货币）",
      "缺少真实场景测试（本地地点）",
      "没有视频评测嵌入",
      "缺少购买指南（本地零售商）",
      "FAQ 部分不完整"
    ],
    "avg_word_count": 2800,
    "recommended_h2s": [
      "所有 2026 年新相机",
      "完整对比：规格和价格",
      "每种摄影师的最佳相机",
      "在哪里购买（含最新价格）",
      "我们的测试方法",
      "常见问题"
    ],
    "missing_schema": [
      "CollectionPage",
      "FAQPage",
      "BreadcrumbList"
    ],
    "content_quality_score": 6.5
  },
  "eeat_validation": {
    "author_box": true,
    "testing_methodology": true,
    "local_locations": true,
    "pros_and_cons": true,
    "last_updated": true
  }
}