{
  "language": "tr-TR",
  "meta_data": {
    "title": "Yeni Kameralar 2026: Çıkışlar ve Fiyatlar Hakkında Tam Kılavuz",
    "description": "Türkiye fiyatlarıyla yeni kameralar 2026'yı keşfedin, tam incelemeler ve karşılaştırmalar. İdeal kameranızı bulun.",
    "canonical_url": "https://dawidmillenium-design.github.io/VideoCameraHoliday/tr-TR/guias/nuevas-camaras-2026/"
  },
  "schema_markup": {
    "collection_page": {
      "@context": "https://schema.org",
      "@type": "CollectionPage",
      "name": "Yeni Kameralar 2026: Çıkışlar ve Fiyatlar Hakkında Tam Kılavuz",
      "description": "Türkiye fiyatlarıyla yeni kameralar 2026'yı keşfedin, tam incelemeler ve karşılaştırmalar. İdeal kameranızı bulun.",
      "url": "https://dawidmillenium-design.github.io/VideoCameraHoliday/tr-TR/guias/nuevas-camaras-2026/",
      "inLanguage": "tr-TR",
      "isPartOf": {
        "@type": "WebSite",
        "name": "VideoCameraHoliday",
        "url": "https://dawidmillenium-design.github.io/VideoCameraHoliday/"
      }
    },
    "faq_page": {
      "@context": "https://schema.org",
      "@type": "FAQPage",
      "mainEntity": [
        {
          "@type": "Question",
          "name": "2026'nın en iyi yeni kamerası hangisi?",
          "acceptedAnswer": {
            "@type": "Answer",
            "text": "Kullanıma bağlı. Çoğu insan için Sony A7 V fotoğraf ve video arasında en iyi dengeyi sunar."
          }
        },
        {
          "@type": "Question",
          "name": "Türkiye'de yeni kamera fiyatları ne kadar?",
          "acceptedAnswer": {
            "@type": "Answer",
            "text": "Model ve mağazaya göre 9.000₺ ile 20.000₺ arasında değişir."
          }
        },
        {
          "@type": "Question",
          "name": "İthal kameralar nerede alınır?",
          "acceptedAnswer": {
            "@type": "Answer",
            "text": "Garanti için Amazon.tr veya Teknosa'daki resmi satıcıları öneriyoruz."
          }
        }
      ]
    },
    "breadcrumb_list": {
      "@context": "https://schema.org",
      "@type": "BreadcrumbList",
      "itemListElement": [
        {
          "@type": "ListItem",
          "position": 1,
          "name": "Ana Sayfa",
          "item": "https://dawidmillenium-design.github.io/VideoCameraHoliday/ana-sayfa"
        },
        {
          "@type": "ListItem",
          "position": 2,
          "name": "Yeni Kameralar",
          "item": "https://dawidmillenium-design.github.io/VideoCameraHoliday/ana-sayfa/yeni-kameralar"
        },
        {
          "@type": "ListItem",
          "position": 3,
          "name": "Türkiye",
          "item": "https://dawidmillenium-design.github.io/VideoCameraHoliday/ana-sayfa/yeni-kameralar/türkiye"
        },
        {
          "@type": "ListItem",
          "position": 4,
          "name": "Yeni Kameralar 2026",
          "item": "https://dawidmillenium-design.github.io/VideoCameraHoliday/ana-sayfa/yeni-kameralar/türkiye/yeni-kameralar-2026"
        }
      ]
    },
    "meta_title": "Yeni Kameralar 2026: Çıkışlar ve Fiyatlar Hakkında Tam Kılavuz",
    "meta_description": "Türkiye fiyatlarıyla yeni kameralar 2026'yı keşfedin, tam incelemeler ve karşılaştırmalar. İdeal kameranızı bulun."
  },
  "content_brief": {
    "h2_outline": [
      "所有 2026 年新相机",
      "完整对比：规格和价格",
      "每种摄影师的最佳相机",
      "在哪里购买（含最新价格）",
      "我们的测试方法",
      "常见问题"
    ],
    "local_eeat_hooks": [
      "测试地点：Istanbul, Ankara, Cappadocia",
      "本地零售商价格比较：Amazon.tr, Teknosa, Vatan Computer",
      "真实场景测试：城市街道、自然风光、低光环境",
      "气候适应性测试：高温、高湿、寒冷条件",
      "作者资质：10 年以上专业摄影经验"
    ],
    "local_pricing_currency": "₺",
    "local_retailers": [
      "Amazon.tr",
      "Teknosa",
      "Vatan Computer",
      "Hepsiburada"
    ],
    "test_locations": [
      "Istanbul",
      "Ankara",
      "Cappadocia",
      "Turkish Riviera"
    ],
    "target_word_count": 4000,
    "tone": "专业但友好，使用本地习语",
    "target_audience": "摄影爱好者和专业视频创作者"
  },
  "internal_link_map": {
    "hub_links": [
      "https://dawidmillenium-design.github.io/VideoCameraHoliday/new-cameras/",
      "https://dawidmillenium-design.github.io/VideoCameraHoliday/tr-TR/guias/"
    ],
    "cluster_links": [
      "https://dawidmillenium-design.github.io/VideoCameraHoliday/tr-TR/guias/fujifilm-x100vi/",
      "https://dawidmillenium-design.github.io/VideoCameraHoliday/tr-TR/guias/sony-a7-v/",
      "https://dawidmillenium-design.github.io/VideoCameraHoliday/tr-TR/guias/dji-pocket-4p/"
    ],
    "regional_links": [
      "https://dawidmillenium-design.github.io/VideoCameraHoliday/tr-TR/guias/best-camera-travel/",
      "https://dawidmillenium-design.github.io/VideoCameraHoliday/tr-TR/guias/professional-cameras/"
    ]
  },
  "keywords": {
    "primary": "yeni kameralar 2026",
    "long_tail": [
      "2026 en iyi yeni kameralar Türkiye",
      "Sony kamera 2026 fiyat Amazon.tr",
      "Canon kamera 2026 Teknosa",
      "seyahat kamerası 2026 İstanbul",
      "profesyonel kamera 2026 Ankara"
    ],
    "search_intent": "commercial_investigation"
  },
  "competitor_data": {
    "competitor_gaps": [
      "缺乏本地价格信息（本地货币）",
      "缺少真实场景测试（本地地点）",
      "没有视频评测嵌入",
      "缺少购买指南（本地零售商）",
      "FAQ 部分不完整"
    ],
    "avg_word_count": 2800,
    "recommended_h2s": [
      "所有 2026 年新相机",
      "完整对比：规格和价格",
      "每种摄影师的最佳相机",
      "在哪里购买（含最新价格）",
      "我们的测试方法",
      "常见问题"
    ],
    "missing_schema": [
      "CollectionPage",
      "FAQPage",
      "BreadcrumbList"
    ],
    "content_quality_score": 6.5
  },
  "eeat_validation": {
    "author_box": true,
    "testing_methodology": true,
    "local_locations": true,
    "pros_and_cons": true,
    "last_updated": true
  }
}