{
  "language": "de-DE",
  "meta_data": {
    "title": "Neue Kameras 2026: Kompletter Guide zu Neuheiten und Preisen",
    "description": "Entdecke die neuen Kameras 2026 mit Preisen in Deutschland, vollständige Tests und Vergleiche. Finde deine ideale Kamera.",
    "canonical_url": "https://dawidmillenium-design.github.io/VideoCameraHoliday/de-DE/guias/nuevas-camaras-2026/"
  },
  "schema_markup": {
    "collection_page": {
      "@context": "https://schema.org",
      "@type": "CollectionPage",
      "name": "Neue Kameras 2026: Kompletter Guide zu Neuheiten und Preisen",
      "description": "Entdecke die neuen Kameras 2026 mit Preisen in Deutschland, vollständige Tests und Vergleiche. Finde deine ideale Kamera.",
      "url": "https://dawidmillenium-design.github.io/VideoCameraHoliday/de-DE/guias/nuevas-camaras-2026/",
      "inLanguage": "de-DE",
      "isPartOf": {
        "@type": "WebSite",
        "name": "VideoCameraHoliday",
        "url": "https://dawidmillenium-design.github.io/VideoCameraHoliday/"
      }
    },
    "faq_page": {
      "@context": "https://schema.org",
      "@type": "FAQPage",
      "mainEntity": [
        {
          "@type": "Question",
          "name": "Was ist die beste neue Kamera 2026?",
          "acceptedAnswer": {
            "@type": "Answer",
            "text": "Abhängig vom Einsatz. Für die meisten bietet die Sony A7 V das beste Foto/Video-Verhältnis."
          }
        },
        {
          "@type": "Question",
          "name": "Wie viel kostet eine neue Kamera in Deutschland?",
          "acceptedAnswer": {
            "@type": "Answer",
            "text": "Preise variieren von 900€ bis 2000€ je nach Modell und Händler."
          }
        },
        {
          "@type": "Question",
          "name": "Wo kann man importierte Kameras kaufen?",
          "acceptedAnswer": {
            "@type": "Answer",
            "text": "Wir empfehlen offizielle Verkäufer auf Amazon.de oder MediaMarkt für Garantie."
          }
        }
      ]
    },
    "breadcrumb_list": {
      "@context": "https://schema.org",
      "@type": "BreadcrumbList",
      "itemListElement": [
        {
          "@type": "ListItem",
          "position": 1,
          "name": "Start",
          "item": "https://dawidmillenium-design.github.io/VideoCameraHoliday/start"
        },
        {
          "@type": "ListItem",
          "position": 2,
          "name": "Neue Kameras",
          "item": "https://dawidmillenium-design.github.io/VideoCameraHoliday/start/neue-kameras"
        },
        {
          "@type": "ListItem",
          "position": 3,
          "name": "Deutschland",
          "item": "https://dawidmillenium-design.github.io/VideoCameraHoliday/start/neue-kameras/deutschland"
        },
        {
          "@type": "ListItem",
          "position": 4,
          "name": "Neue Kameras 2026",
          "item": "https://dawidmillenium-design.github.io/VideoCameraHoliday/start/neue-kameras/deutschland/neue-kameras-2026"
        }
      ]
    },
    "meta_title": "Neue Kameras 2026: Kompletter Guide zu Neuheiten und Preisen",
    "meta_description": "Entdecke die neuen Kameras 2026 mit Preisen in Deutschland, vollständige Tests und Vergleiche. Finde deine ideale Kamera."
  },
  "content_brief": {
    "h2_outline": [
      "所有 2026 年新相机",
      "完整对比：规格和价格",
      "每种摄影师的最佳相机",
      "在哪里购买（含最新价格）",
      "我们的测试方法",
      "常见问题"
    ],
    "local_eeat_hooks": [
      "测试地点：Berlin, Munich, Black Forest",
      "本地零售商价格比较：Amazon.de, MediaMarkt, Saturn",
      "真实场景测试：城市街道、自然风光、低光环境",
      "气候适应性测试：高温、高湿、寒冷条件",
      "作者资质：10 年以上专业摄影经验"
    ],
    "local_pricing_currency": "€",
    "local_retailers": [
      "Amazon.de",
      "MediaMarkt",
      "Saturn",
      "Foto Erhardt"
    ],
    "test_locations": [
      "Berlin",
      "Munich",
      "Black Forest",
      "Bavarian Alps"
    ],
    "target_word_count": 4000,
    "tone": "专业但友好，使用本地习语",
    "target_audience": "摄影爱好者和专业视频创作者"
  },
  "internal_link_map": {
    "hub_links": [
      "https://dawidmillenium-design.github.io/VideoCameraHoliday/new-cameras/",
      "https://dawidmillenium-design.github.io/VideoCameraHoliday/de-DE/guias/"
    ],
    "cluster_links": [
      "https://dawidmillenium-design.github.io/VideoCameraHoliday/de-DE/guias/fujifilm-x100vi/",
      "https://dawidmillenium-design.github.io/VideoCameraHoliday/de-DE/guias/sony-a7-v/",
      "https://dawidmillenium-design.github.io/VideoCameraHoliday/de-DE/guias/dji-pocket-4p/"
    ],
    "regional_links": [
      "https://dawidmillenium-design.github.io/VideoCameraHoliday/de-DE/guias/best-camera-travel/",
      "https://dawidmillenium-design.github.io/VideoCameraHoliday/de-DE/guias/professional-cameras/"
    ]
  },
  "keywords": {
    "primary": "neue kameras 2026",
    "long_tail": [
      "beste neue kameras 2026 Deutschland",
      "Sony kameras 2026 preis Amazon.de",
      "Canon kameras 2026 MediaMarkt",
      "kameras für reisen 2026 Berlin",
      "professionelle kameras 2026 München"
    ],
    "search_intent": "commercial_investigation"
  },
  "competitor_data": {
    "competitor_gaps": [
      "缺乏本地价格信息（本地货币）",
      "缺少真实场景测试（本地地点）",
      "没有视频评测嵌入",
      "缺少购买指南（本地零售商）",
      "FAQ 部分不完整"
    ],
    "avg_word_count": 2800,
    "recommended_h2s": [
      "所有 2026 年新相机",
      "完整对比：规格和价格",
      "每种摄影师的最佳相机",
      "在哪里购买（含最新价格）",
      "我们的测试方法",
      "常见问题"
    ],
    "missing_schema": [
      "CollectionPage",
      "FAQPage",
      "BreadcrumbList"
    ],
    "content_quality_score": 6.5
  },
  "eeat_validation": {
    "author_box": true,
    "testing_methodology": true,
    "local_locations": true,
    "pros_and_cons": true,
    "last_updated": true
  }
}