{
  "language": "zh-CN",
  "meta_data": {
    "title": "2026 新款相机：发布与价格完全指南",
    "description": "了解 2026 年新款相机，包含中国价格、完整评测和对比。找到您的理想相机。",
    "canonical_url": "https://dawidmillenium-design.github.io/VideoCameraHoliday/zh-CN/guias/nuevas-camaras-2026/"
  },
  "schema_markup": {
    "collection_page": {
      "@context": "https://schema.org",
      "@type": "CollectionPage",
      "name": "2026 新款相机：发布与价格完全指南",
      "description": "了解 2026 年新款相机，包含中国价格、完整评测和对比。找到您的理想相机。",
      "url": "https://dawidmillenium-design.github.io/VideoCameraHoliday/zh-CN/guias/nuevas-camaras-2026/",
      "inLanguage": "zh-CN",
      "isPartOf": {
        "@type": "WebSite",
        "name": "VideoCameraHoliday",
        "url": "https://dawidmillenium-design.github.io/VideoCameraHoliday/"
      }
    },
    "faq_page": {
      "@context": "https://schema.org",
      "@type": "FAQPage",
      "mainEntity": [
        {
          "@type": "Question",
          "name": "2026 年最好的新款相机是哪款？",
          "acceptedAnswer": {
            "@type": "Answer",
            "text": "取决于用途。对大多数人来说，Sony A7 V 在照片和视频之间提供了最佳平衡。"
          }
        },
        {
          "@type": "Question",
          "name": "中国新款相机多少钱？",
          "acceptedAnswer": {
            "@type": "Answer",
            "text": "根据型号和店铺，价格从 9000 元到 20000 元不等。"
          }
        },
        {
          "@type": "Question",
          "name": "哪里可以买进口相机？",
          "acceptedAnswer": {
            "@type": "Answer",
            "text": "我们推荐京东或天猫的官方卖家以获得保修服务。"
          }
        }
      ]
    },
    "breadcrumb_list": {
      "@context": "https://schema.org",
      "@type": "BreadcrumbList",
      "itemListElement": [
        {
          "@type": "ListItem",
          "position": 1,
          "name": "首页",
          "item": "https://dawidmillenium-design.github.io/VideoCameraHoliday/首页"
        },
        {
          "@type": "ListItem",
          "position": 2,
          "name": "新款相机",
          "item": "https://dawidmillenium-design.github.io/VideoCameraHoliday/首页/新款相机"
        },
        {
          "@type": "ListItem",
          "position": 3,
          "name": "中国",
          "item": "https://dawidmillenium-design.github.io/VideoCameraHoliday/首页/新款相机/中国"
        },
        {
          "@type": "ListItem",
          "position": 4,
          "name": "2026 新款相机",
          "item": "https://dawidmillenium-design.github.io/VideoCameraHoliday/首页/新款相机/中国/2026-新款相机"
        }
      ]
    },
    "meta_title": "2026 新款相机：发布与价格完全指南",
    "meta_description": "了解 2026 年新款相机，包含中国价格、完整评测和对比。找到您的理想相机。"
  },
  "content_brief": {
    "h2_outline": [
      "所有 2026 年新相机",
      "完整对比：规格和价格",
      "每种摄影师的最佳相机",
      "在哪里购买（含最新价格）",
      "我们的测试方法",
      "常见问题"
    ],
    "local_eeat_hooks": [
      "测试地点：北京, 上海, 桂林",
      "本地零售商价格比较：京东, 天猫, 苏宁易购",
      "真实场景测试：城市街道、自然风光、低光环境",
      "气候适应性测试：高温、高湿、寒冷条件",
      "作者资质：10 年以上专业摄影经验"
    ],
    "local_pricing_currency": "¥",
    "local_retailers": [
      "京东",
      "天猫",
      "苏宁易购",
      "国美在线"
    ],
    "test_locations": [
      "北京",
      "上海",
      "桂林",
      "张家界"
    ],
    "target_word_count": 4000,
    "tone": "专业但友好，使用本地习语",
    "target_audience": "摄影爱好者和专业视频创作者"
  },
  "internal_link_map": {
    "hub_links": [
      "https://dawidmillenium-design.github.io/VideoCameraHoliday/new-cameras/",
      "https://dawidmillenium-design.github.io/VideoCameraHoliday/zh-CN/guias/"
    ],
    "cluster_links": [
      "https://dawidmillenium-design.github.io/VideoCameraHoliday/zh-CN/guias/fujifilm-x100vi/",
      "https://dawidmillenium-design.github.io/VideoCameraHoliday/zh-CN/guias/sony-a7-v/",
      "https://dawidmillenium-design.github.io/VideoCameraHoliday/zh-CN/guias/dji-pocket-4p/"
    ],
    "regional_links": [
      "https://dawidmillenium-design.github.io/VideoCameraHoliday/zh-CN/guias/best-camera-travel/",
      "https://dawidmillenium-design.github.io/VideoCameraHoliday/zh-CN/guias/professional-cameras/"
    ]
  },
  "keywords": {
    "primary": "2026 新款相机",
    "long_tail": [
      "2026 年最佳新相机 中国",
      "索尼相机 2026 价格 京东",
      "佳能相机 2026 天猫",
      "旅行相机 2026 北京",
      "专业相机 2026 上海"
    ],
    "search_intent": "commercial_investigation"
  },
  "competitor_data": {
    "competitor_gaps": [
      "缺乏本地价格信息（本地货币）",
      "缺少真实场景测试（本地地点）",
      "没有视频评测嵌入",
      "缺少购买指南（本地零售商）",
      "FAQ 部分不完整"
    ],
    "avg_word_count": 2800,
    "recommended_h2s": [
      "所有 2026 年新相机",
      "完整对比：规格和价格",
      "每种摄影师的最佳相机",
      "在哪里购买（含最新价格）",
      "我们的测试方法",
      "常见问题"
    ],
    "missing_schema": [
      "CollectionPage",
      "FAQPage",
      "BreadcrumbList"
    ],
    "content_quality_score": 6.5
  },
  "eeat_validation": {
    "author_box": true,
    "testing_methodology": true,
    "local_locations": true,
    "pros_and_cons": true,
    "last_updated": true
  }
}