{
  "language": "hi-IN",
  "meta_data": {
    "title": "नए कैमरे 2026: लॉन्च और कीमतों की पूरी गाइड",
    "description": "2026 के नए कैमरे भारत की कीमतों, पूर्ण समीक्षाओं और तुलना के साथ जानें। अपना आदर्श कैमरा खोजें।",
    "canonical_url": "https://dawidmillenium-design.github.io/VideoCameraHoliday/hi-IN/guias/nuevas-camaras-2026/"
  },
  "schema_markup": {
    "collection_page": {
      "@context": "https://schema.org",
      "@type": "CollectionPage",
      "name": "नए कैमरे 2026: लॉन्च और कीमतों की पूरी गाइड",
      "description": "2026 के नए कैमरे भारत की कीमतों, पूर्ण समीक्षाओं और तुलना के साथ जानें। अपना आदर्श कैमरा खोजें।",
      "url": "https://dawidmillenium-design.github.io/VideoCameraHoliday/hi-IN/guias/nuevas-camaras-2026/",
      "inLanguage": "hi-IN",
      "isPartOf": {
        "@type": "WebSite",
        "name": "VideoCameraHoliday",
        "url": "https://dawidmillenium-design.github.io/VideoCameraHoliday/"
      }
    },
    "faq_page": {
      "@context": "https://schema.org",
      "@type": "FAQPage",
      "mainEntity": [
        {
          "@type": "Question",
          "name": "2026 का सबसे अच्छा नया कैमरा कौन सा है?",
          "acceptedAnswer": {
            "@type": "Answer",
            "text": "यह उपयोग पर निर्भर करता है। ज्यादातर लोगों के लिए, Sony A7 V फोटो और वीडियो में सर्वोत्तम संतुलन देता है।"
          }
        },
        {
          "@type": "Question",
          "name": "भारत में नए कैमरे की कीमत क्या है?",
          "acceptedAnswer": {
            "@type": "Answer",
            "text": "मॉडल और स्टोर के अनुसार 90,000₹ से 200,000₹ तक भिन्न होती है।"
          }
        },
        {
          "@type": "Question",
          "name": "आयातित कैमरे कहाँ से खरीदें?",
          "acceptedAnswer": {
            "@type": "Answer",
            "text": "वारंटी के लिए हम अमेज़न या फ्लिपकार्ट पर आधिकारिक विक्रेताओं की सलाह देते हैं।"
          }
        }
      ]
    },
    "breadcrumb_list": {
      "@context": "https://schema.org",
      "@type": "BreadcrumbList",
      "itemListElement": [
        {
          "@type": "ListItem",
          "position": 1,
          "name": "होम",
          "item": "https://dawidmillenium-design.github.io/VideoCameraHoliday/होम"
        },
        {
          "@type": "ListItem",
          "position": 2,
          "name": "नए कैमरे",
          "item": "https://dawidmillenium-design.github.io/VideoCameraHoliday/होम/नए-कैमरे"
        },
        {
          "@type": "ListItem",
          "position": 3,
          "name": "भारत",
          "item": "https://dawidmillenium-design.github.io/VideoCameraHoliday/होम/नए-कैमरे/भारत"
        },
        {
          "@type": "ListItem",
          "position": 4,
          "name": "नए कैमरे 2026",
          "item": "https://dawidmillenium-design.github.io/VideoCameraHoliday/होम/नए-कैमरे/भारत/नए-कैमरे-2026"
        }
      ]
    },
    "meta_title": "नए कैमरे 2026: लॉन्च और कीमतों की पूरी गाइड",
    "meta_description": "2026 के नए कैमरे भारत की कीमतों, पूर्ण समीक्षाओं और तुलना के साथ जानें। अपना आदर्श कैमरा खोजें।"
  },
  "content_brief": {
    "h2_outline": [
      "所有 2026 年新相机",
      "完整对比：规格和价格",
      "每种摄影师的最佳相机",
      "在哪里购买（含最新价格）",
      "我们的测试方法",
      "常见问题"
    ],
    "local_eeat_hooks": [
      "测试地点：Delhi, Mumbai, Goa",
      "本地零售商价格比较：Amazon.in, Flipkart, Croma",
      "真实场景测试：城市街道、自然风光、低光环境",
      "气候适应性测试：高温、高湿、寒冷条件",
      "作者资质：10 年以上专业摄影经验"
    ],
    "local_pricing_currency": "₹",
    "local_retailers": [
      "Amazon.in",
      "Flipkart",
      "Croma",
      "Reliance Digital"
    ],
    "test_locations": [
      "Delhi",
      "Mumbai",
      "Goa",
      "Himalayas"
    ],
    "target_word_count": 4000,
    "tone": "专业但友好，使用本地习语",
    "target_audience": "摄影爱好者和专业视频创作者"
  },
  "internal_link_map": {
    "hub_links": [
      "https://dawidmillenium-design.github.io/VideoCameraHoliday/new-cameras/",
      "https://dawidmillenium-design.github.io/VideoCameraHoliday/hi-IN/guias/"
    ],
    "cluster_links": [
      "https://dawidmillenium-design.github.io/VideoCameraHoliday/hi-IN/guias/fujifilm-x100vi/",
      "https://dawidmillenium-design.github.io/VideoCameraHoliday/hi-IN/guias/sony-a7-v/",
      "https://dawidmillenium-design.github.io/VideoCameraHoliday/hi-IN/guias/dji-pocket-4p/"
    ],
    "regional_links": [
      "https://dawidmillenium-design.github.io/VideoCameraHoliday/hi-IN/guias/best-camera-travel/",
      "https://dawidmillenium-design.github.io/VideoCameraHoliday/hi-IN/guias/professional-cameras/"
    ]
  },
  "keywords": {
    "primary": "नए कैमरे 2026",
    "long_tail": [
      "2026 के सर्वश्रेष्ठ नए कैमरे भारत",
      "सोनी कैमरा 2026 कीमत अमेज़न",
      "कैनन कैमरा 2026 फ्लिपकार्ट",
      "यात्रा के लिए कैमरा 2026 दिल्ली",
      "प्रोफेशनल कैमरा 2026 मुंबई"
    ],
    "search_intent": "commercial_investigation"
  },
  "competitor_data": {
    "competitor_gaps": [
      "缺乏本地价格信息（本地货币）",
      "缺少真实场景测试（本地地点）",
      "没有视频评测嵌入",
      "缺少购买指南（本地零售商）",
      "FAQ 部分不完整"
    ],
    "avg_word_count": 2800,
    "recommended_h2s": [
      "所有 2026 年新相机",
      "完整对比：规格和价格",
      "每种摄影师的最佳相机",
      "在哪里购买（含最新价格）",
      "我们的测试方法",
      "常见问题"
    ],
    "missing_schema": [
      "CollectionPage",
      "FAQPage",
      "BreadcrumbList"
    ],
    "content_quality_score": 6.5
  },
  "eeat_validation": {
    "author_box": true,
    "testing_methodology": true,
    "local_locations": true,
    "pros_and_cons": true,
    "last_updated": true
  }
}